{
  "$schema": "https://raw.githubusercontent.com/FinalForEach/Cosmic-Reach-Localization/master/assets/base/lang/game.schema.json",
  "metadata":
  {
    "name": "Türkçe"
  },
  "formatPercent": "%#",
  "startButton": "Başlat",
  "loadButton": "Kayıt Klasörünü Aç",
  "optionsButton": "Ayarlar",
  "quitButton": "Çıkış",
  "vSyncButton": "Dikey Senkronizasyon: ",
  "creditsButton": "Katkıda Bulunanlar",
  "renderDistSlider": "Görüş Mesafesi: ",
  "invertedMouseButton": "Fare Kontrollerini Tersine Çevir: ",
  "mouseSensitivitySlider": "Fare Hassasiyeti: ",
  "soundSlider": "Ses Düzeyi: ",
  "musicSlider": "Müzik: ",
  "musicFreqSlider": "Dakikadaki Müzik Sıklığı: ",
  "fovSlider": "Görüş Açısı: ",
  "maxFPS": "Maksimum Kare Sayısı: ",
  "maxFPSUnlimited": "Maksimum Kare Sayısı: Sınırsız",
  "debugCrashButton": "Hata Ayıklama: Oyunu çökert",
  "keybindsButton": "Tuş Atamaları",
  "difficultyButton": "Zorluk: ",
  "difficultyPeaceful": "Barışçıl",
  "difficultyEasy": "Kolay",
  "difficultyNormal": "Normal",
  "difficultyHard": "Zor",
  "languagesButton": "Dil",
  "rendererButton": "Görüntü işleyici: ",
  "rendererNaive": "Basit",
  "rendererBatched": "Gruplu",
  "doneButton": "Bitti",
  "preAlphaText": "Cosmic Reach'e Hoş Geldin! \n Oyun oldukça erken bir geliştirme aşamasında, eksik özellikleri var, bitmeye yakın bile değil. \n Muhtemelen Buglarla, Hatalarla, çökmelerle ve dünya bozulmalarla karşılaşacaksın. \n Her şey değişikliğe tabidir ve nihai oyunu temsil etmemektedir.\n Bu oyun, geri bildirim vererek oyunun geleceğini şekillendirmeye yardımcı olabilmeniz için oynanabilir durumda. \n Keyifli testler... ve oyunu bozmayı da unutma!",
  "okButton": "Tamam",
  "Lighting": "Aydınlatma: ",
  "Respawn": "Yeniden Canlan",
  "YOU_ARE_DEAD": "ÖLDÜN",
  "Return_To_Game": "Oyuna Dön",
  "Return_To_Menu": "Ana Menüye Dön",
  "Saving": "Kaydediliyor...",
  "Dynamic_Sky": "Dinamik Gökyüzü",
  "Space_Day": "Uzay Gündüzü",
  "Dark_Night": "Karanlık Gece",
  "Earth_Day": "Dünya Gündüzü",
  "Orange_Sky": "Turuncu Gökyüzü",
  "Pitch_Dark": "Zifiri Karanlık",
  "Overcast": "Bulutlu",
  "Forward": "İleri",
  "Backward": "Geri",
  "Left": "Sol",
  "Right": "Sağ",
  "Jump": "Zıpla",
  "Crouch": "Eğil",
  "Sprint": "Koş",
  "Prone": "Sürün",
  "Inventory": "Envanter",
  "Drop_Item": "Eşyayı Bırak",
  "Cycle_Item_Type": "Döngü Eşya Türü",
  "Hide_UI": "Arayüzü Gizle",
  "Screenshot": "Ekran Görüntüsü",
  "Debug_Info": "Hata Ayıklama Bilgisi",
  "Attack_Break": "Saldır / Kır",
  "Pick_Block": "Blok Seç",
  "Use_Place": "Kullan / Yerleştir",
  "Open_Chat": "Sohbeti Aç",
  "No_Clip": "Duvardan Geçme",
  "Change_Perspective": "Perspektifi Değiştir",
  "Reload_Shaders": "Gölgelendirmeleri Yenile",
  "Fullscreen": "Tam Ekran",
  "Create_New_World": "Yeni Dünya Oluştur",
  "worldNameButton": "Dünya Adı: ",
  "defaultWorldName": "Yeni Dünya",
  "worldSeedLabel": "Dünya tohumu: <Rastgele>",
  "worldSeedLabel2": "Dünya tohumu: ",
  "worldType": "Dünya Tipi: ",
  "Return_to_Main_Menu": "Ana Menüye Dön",
  "returnButton": "Geri",
  "Open_Worlds_Directory": "Dünyaların Klasörünü Aç",
  "YT_Channel": "Geliştirme günlüklerini youtube.com/@finalforeach adresinden izleyebilirsin",
  "Game_version_prealpha": "Cosmic Reach Sürüm Pre-alpha-",
  "Game_version_alpha": "Cosmic Reach Sürüm Alpha-",
  "Game_version_beta": "Cosmic Reach Sürüm Beta-",
  "Game_version_release": "Cosmic Reach Sürüm ",
  "MAC_warning": "UYARI: Mac şu anda desteklenmemektedir. Oyunun Mac'te çalışması mümkün değildir.",
  "Controller": "Kontrolcü",
  "Controllers": "Kontrolcüler",
  "Controller_info": " algılandı!\nKontrolcü desteği şu anda tamamlanmamıştır,\n ve ilerleyen güncellemelerde geliştirilecektir..",
  "on_state": "Açık",
  "off_state": "Kapalı",
  "World_name": "Dünya-",
  "Screenshot_info": "Ekran görüntüsü şuraya kaydedildi: ",
  "Screenshot_error": "Ekran görüntüsü kaydedilirken bir hata oluştu.",
  "Loading": "Yükleniyor",
  "mouseLeftButton" : "Sol Düğme",
  "mouseMiddleButton" : "Orta Düğme",
  "mouseRightButton" : "Sağ Düğme",
  "mouseBackButton" : "Geri Düğmesi",
  "mouseForwardButton" : "İleri Düğmesi",
  "RuntimeException": "Şu dünya yüklenemiyor: ",
  "creditsGameBy": "OYUN YAPIMCISI:",
  "creditsMusic": "MÜZİK:",
  "creditsAdditionalProgramming": "İLAVE PROGRAMLAMA:",
  "creditsAdditionalModelling": "İLAVE MODELLEME:",
  "creditsAdditionalTexturing": "İLAVE DOKULANDIRMA:",
  "creditsAdditionalMobs": "EK YARATIKLAR:",
  "creditsLocalization": "YERELLEŞTİRME:",
  "multiplayerButton": "Çok Oyunculu",
  "multiplayerAddressButton": "Adres: ",
  "multiplayerJoinButton": "Katıl",
  "multiplayerBadDisconnect": "Bağlantı kesildi! Sebep:",
  "textDisplayInput": "Buraya yaz...",
  "skinChangeLabel": "Skin Değiştir",
  "skinFileDesc": "128'e 64 Pixel PNG dosyası",
  "itemCatalogSearch": "Ara...",
  "boomboxOctave": "Oktav",
  "boomboxPlaySound": "Oynat",
  "worldSelectionSearch": "Dünya Ara...",
  "createWorldGamemode": "Oyun Modu:",
  "gamemode_survival": "Hayatta Kalma",
  "gamemode_creative": "Yaratıcı",
  "zone_base:earth": "Dünya",
  "zone_base:flat": "Düzlük",
  "zone_base:moon": "Ay",
  "zone_base:nostalgic_island": "Nostalji Adaları",
  "zone_base:void": "Boşluk Dünyası",
  "mobUnnamed": "Adsız",
  "zone_base:earth_legacy": "Dünya (Eski)",
  "comingSoon": "Çok Yakında...",
  "langSelectionSearch": "Dil Ara...",
  "worldDescriptionName": "Dünya Adı:",
  "worldDescriptionHeader": "Açıklama",
  "worldDescriptionGamemode": "Oyun Modu: ",
  "worldDescriptionGenerator": "Dünya Tipi: ",
  "worldDescriptionDefaultText": "Dünya Açıklaması Girin...",
  "worldSelectPlayWorld": "Oyna",
  "worldSelectSaveChanges": "Değişiklikleri Kaydet",
  "loadingAssets": "Kaynaklar",
  "loadingWorld": "Dünya",
  "multiplayerServerName": "Sunucu İsmi: ",
  "multiplayerAddServer": "Dunucu Ekle",
  "multiplayerNewServerDefaultName": "Yeni Sunucu",
  "multiplayerDeleteServer": "Sunucuyu Sil",
  "multiplayerDeleteConfirmPrompt": "{0}'yı silmek istediğinize emin misiniz?",
  "multiplayerEditServer": "Sunucuyu Düzenle",
  "genericSelectionSearch": "Ara..."
}
