{
  "$schema": "https://raw.githubusercontent.com/FinalForEach/Cosmic-Reach-Localization/master/assets/base/lang/game.schema.json",
  "metadata":
  {
    "name": "English (United Kingdom)"
  },
  "formatPercent": "#%",
  "startButton": "Start",
  "loadButton": "Open Save Directory",
  "optionsButton": "Options",
  "quitButton": "Quit",
  "vSyncButton": "Vsync: ",
  "cloudsButton": "Clouds: ",
  "creditsButton": "Credits",
  "renderDistSlider": "Render Distance: ",
  "invertedMouseButton": "Inverted Mouse: ",
  "mouseSensitivitySlider": "Mouse Sensitivity: ",
  "soundSlider": "Sound: ",
  "musicSlider": "Music: ",
  "fovSlider": "FOV: ",
  "maxFPS": "Max FPS: ",
  "maxFPSUnlimited": "Max FPS: Unlimited",
  "debugCrashButton": "Debug: Crash the game",
  "keybindsButton": "Keybinds",
  "difficultyButton": "Difficulty: ",
  "difficultyPeaceful": "Peaceful",
  "difficultyEasy": "Easy",
  "difficultyNormal": "Normal",
  "difficultyHard": "Hard",
  "languagesButton": "Language",
  "rendererButton": "Renderer: ",
  "rendererNaive": "Naive",
  "rendererBatched": "Batched",
  "doneButton": "Done",
  "preAlphaText": "Welcome to Cosmic Reach! \n The game is in very early development, it is missing features, is nowhere near complete, \n and will likely have bugs, glitches, crashes and world corruption.\n Everything is subject to change and is not representative of the final game.\n It's available for you to play so that you can give feedback to help guide the future of this game \n Happy testing... and game-breaking!",
  "okButton": "Ok",
  "Lighting": "Lighting: ",
  "Respawn": "Respawn",
  "YOU_ARE_DEAD": "YOU ARE DEAD.",
  "Return_To_Game": "Return To Game",
  "Return_To_Menu": "Return To Menu",
  "Saving": "Saving...",
  "Dynamic_Sky": "Dynamic Sky",
  "Space_Day": "Space Day",
  "Dark_Night": "Dark Night",
  "Earth_Day": "Earth Day",
  "Orange_Sky": "Orange Sky",
  "Pitch_Dark": "Pitch Dark",
  "Overcast": "Overcast",
  "Forward": "Forward",
  "Backward": "Backward",
  "Left": "Left",
  "Right": "Right",
  "Jump": "Jump",
  "Crouch": "Crouch",
  "Sprint": "Sprint",
  "Prone": "Prone",
  "Inventory": "Inventory",
  "Cycle_Item_Type": "Cycle Item Type",
  "Drop_Item": "Drop Item",
  "Hide_UI": "Hide UI",
  "Screenshot": "Screenshot",
  "Debug_Info": "Debug Info",
  "Attack_Break": "Attack / Break",
  "Pick_Block": "Pick Block",
  "Use_Place": "Use / Place",
  "Open_Chat": "Open Chat",
  "No_Clip": "No-Clip",
  "Reload_Shaders": "Reload Shaders",
  "Fullscreen": "Fullscreen",
  "Create_New_World": "Create New World",
  "worldNameButton": "World name: ",
  "defaultWorldName": "New World",
  "worldSeedLabel": "World seed: <Random>",
  "worldSeedLabel2": "World seed: ",
  "worldType": "World Type: ",
  "Return_to_Main_Menu": "Return to Main Menu",
  "returnButton": "Back",
  "Open_Worlds_Directory": "Open Worlds Directory",
  "YT_Channel": "Watch the devlogs at youtube.com/@finalforeach",
  "Game_version_prealpha": "Cosmic Reach Version Pre-alpha-",
  "Game_version_alpha": "Cosmic Reach Version Alpha-",
  "Game_version_beta": "Cosmic Reach Version Beta-",
  "Game_version_release": "Cosmic Reach Version ",
  "MAC_warning": "WARNING: Mac is not supported at this time. The game is unlikely to work.",
  "Controller": "Controller",
  "Controllers": "Controllers",
  "Controller_info": " detected!\nController support is incomplete now,\nand will be improved in later updates.",
  "on_state": "On",
  "off_state": "Off",
  "World_name": "World-",
  "Screenshot_info": "Saved screenshot to ",
  "Screenshot_error": "Error saving screenshot.",
  "Loading": "Loading",
  "mouseLeftButton" : "Left Button",
  "mouseMiddleButton" : "Middle Button",
  "mouseRightButton" : "Right Button",
  "mouseBackButton" : "Back Button",
  "mouseForwardButton" : "Forward Button",
  "RuntimeException": "Could not load world: ",
  "creditsGameBy": "GAME BY:",
  "creditsMusic": "MUSIC:",
  "creditsAdditionalProgramming": "ADDITIONAL PROGRAMMING:",
  "creditsAdditionalModelling": "ADDITIONAL MODELLING:",
  "creditsAdditionalTexturing": "ADDITIONAL TEXTURING:",
  "creditsLocalization": "LOCALIZATION:",
  "multiplayerButton": "Multiplayer",
  "multiplayerAddressButton": "Address: ",
  "multiplayerJoinButton": "Join",
  "multiplayerBadDisconnect": "Disconnected! Reason:",
  "textDisplayInput": "Type here..."
}
