{
    "metadata": {
        "name": "한국어"
    },
    "formatPercent": "#%",
    "startButton": "싱글 플레이어",
    "loadButton": "세이브 데이터",
    "optionsButton": "옵션",
    "quitButton": "종료",
    "vSyncButton": "Vsync",
    "creditsButton": "크레딧",
    "renderDistSlider": "렌더 거리: ",
    "invertedMouseButton": "마우스 반전: ",
    "mouseSensitivitySlider": "마우스 감도: ",
    "soundSlider": "소리: ",
    "musicSlider": "BGM: ",
    "fovSlider": "FOV: ",
    "musicFreqSlider": "BGM 빈도: ",
    "maxFPS": "최대 FPS: ",
    "maxFPSUnlimited": "최대 FPS: 제한 없음",
    "debugCrashButton": "디버그: ",
    "keybindsButton": "조작키",
    "difficultyButton": "난이도: ",
    "difficultyPeaceful": "평화로움",
    "difficultyEasy": "쉬움",
    "difficultyNormal": "보통",
    "difficultyHard": "어려움",
    "languagesButton": "언어",
    "rendererButton": "렌더러: ",
    "rendererNaive": "단순/직접 처리",
    "rendererBatched": "일괄 처리",
    "doneButton": "완료",
    "preAlphaText": "코스믹 리치에 오신 것을 환영합니다! \n 이 게임은 개발 초기 단계에 있으며, 기능이 부족하고 완성도가 떨어집니다, \n 그리고 버그, 결함, 충돌 및 세계 붕괴가 발생할 가능성이 높습니다. \n 모든 요소는 변경될 수 있으며 최종 게임과 달라질 수 있습니다. \n 이 게임을 플레이하여 도움이 되는 피드백을 제공할 수 있습니다 \n 행복한 테스트 되세요!",
    "okButton": "확인",
    "Lighting": "밝기: ",
    "Respawn": "리스폰",
    "YOU_ARE_DEAD": "당신은 죽었습니다.",
    "Return_To_Game": "게임으로 돌아가기",
    "Return_To_Menu": "메뉴로 돌아가기",
    "Saving": "저장중...",
    "Dynamic_Sky": "다이나믹 스카이",
    "Space_Day": "스페이스 데이",
    "Dark_Night": "다크 나이트",
    "Earth_Day": "어스 데이",
    "Orange_Sky": "오렌지 스카이",
    "Pitch_Dark": "피치 다크",
    "Overcast": "오버캐스트",
    "Forward": "전진",
    "Backward": "후진",
    "Left": "좌",
    "Right": "우",
    "Jump": "점프",
    "Crouch": "앉기",
    "Sprint": "달리기",
    "Prone": "엎드리기",
    "Inventory": "가방",
    "Cycle_Item_Type": "아이템 종류 바꾸기",
    "Drop_Item": "아이템 버리기",
    "Hide_UI": "UI 숨기기",
    "Screenshot": "스크린샷",
    "Debug_Info": "디버그 정보",
    "Attack_Break": "공격 / 부수기",
    "Pick_Block": "블록 선택",
    "Use_Place": "사용 / 놓기",
    "Open_Chat": "대화 열기",
    "No_Clip": "노 클립",
    "Change_Perspective": "시점 변경",
    "Reload_Shaders": "셰이더 리로드",
    "Fullscreen": "풀스크린",
    "Create_New_World": "새로운 세계 생성",
    "worldNameButton": "월드 이름: ",
    "defaultWorldName": "새로운 세계",
    "worldSeedLabel": "월드 시드: <랜덤>",
    "worldSeedLabel2": "월드 시드: ",
    "worldType": "월드 타입: ",
    "Return_to_Main_Menu": "메인 메뉴로 돌아가기",
    "returnButton": "뒤로",
    "Open_Worlds_Directory": "월드 폴더 열기",
    "YT_Channel": "youtube.com/@finalforeach에서 개발 현황을 확인하세요",
    "Game_version_prealpha": "코스믹 리치 버전 Pre-alpha-",
    "Game_version_alpha": "코스믹 리치 버전 Alpha-",
    "Game_version_beta": "코스믹 리치 버전 Beta-",
    "Game_version_release": "코스믹 리지 버전",
    "MAC_warning": "주의: 지금은 맥OS를 지원하지 않습니다. 게임이 올바르게 작동될 가능성이 낮습니다.",
    "Controller": "컨트롤러",
    "Controllers": "컨트롤러",
    "Controller_info": "감지됨!\n아직 컨트롤러 지원이 부족합니다,\n추후 업데이트를 통해 개선됩니다.",
    "on_state": "켬",
    "off_state": "끔",
    "World_name": "세계-",
    "Screenshot_info": "스크린샷을 저장했습니다",
    "Screenshot_error": "스크린샷 저장중 문제가 발생하였습니다.",
    "Loading": "로딩중",
    "mouseLeftButton": "왼쪽 버튼",
    "mouseMiddleButton": "가운데 버튼",
    "mouseRightButton": "오른쪽 버튼",
    "mouseBackButton": "마우스 버튼 4",
    "mouseForwardButton": "마우스 버튼 5",
    "RuntimeException": "월드를 불러오지 못했습니다: ",
    "creditsGameBy": "게임 제작:",
    "creditsMusic": "음악:",
    "creditsAdditionalProgramming": "프로그래밍 참여:",
    "creditsAdditionalModelling": "모델림 참여:",
    "creditsAdditionalTexturing": "텍스쳐링 참여:",
    "creditsAdditionalMobs": "몹 디자인 참여:",
    "creditsLocalization": "현지화 참여:",
    "multiplayerButton": "멀티 플레이어",
    "multiplayerAddressButton": "주소: ",
    "multiplayerJoinButton": "참가",
    "multiplayerBadDisconnect": "연결 끊김! 사유:",
    "textDisplayInput": "여기에 입력...",
    "skinChangeLabel": "스킨 변경",
    "skinFileDesc": "128x64 픽셀의 PNG 파일",
    "itemCatalogSearch": "검색...",
    "boomboxOctave": "옥타브",
    "boomboxPlaySound": "재생",
    "worldSelectionSearch": "월드 검색...",
    "createWorldGamemode": "게임 모드:",
    "gamemode_survival": "서바이벌",
    "gamemode_creative": "크리에이티브",
    "zone_base:earth": "지구",
    "zone_base:flat": "평지",
    "zone_base:moon": "달",
    "zone_base:void": "공허",
    "mobUnnamed": "언네임드",
    "zone_base:earth_legacy": "지구 (레거시)",
    "comingSoon": "곧 공개...",
    "zone_base:nostalgic_island": "그리운 섬"
}