{
  "$schema": "../game.schema.json",
  "metadata": {
    "name": "Indonesia"
  },
  "formatPercent": "#%",
  "startButton": "Bermain Sendiri",
  "loadButton": "Buka Direktori Penyimpanan",
  "optionsButton": "Opsi",
  "quitButton": "Keluar",
  "vSyncButton": "Vsync: ",
  "creditsButton": "Kredit",
  "renderDistSlider": "Jarak Render: ",
  "invertedMouseButton": "Mouse Terbalik: ",
  "mouseSensitivitySlider": "Sensitivitas Mouse: ",
  "soundSlider": "Suara: ",
  "musicSlider": "Musik: ",
  "fovSlider": "FOV: ",
  "musicFreqSlider": "Kekerapan Musik dalam Menit: ",
  "maxFPS": "FPS Maksimum: ",
  "maxFPSUnlimited": "FPS Maksimum: Tak Terbatas",
  "debugCrashButton": "Debug: Paksa permainan crash",
  "keybindsButton": "Pengaturan Tombol",
  "difficultyButton": "Kesulitan: ",
  "difficultyPeaceful": "Damai",
  "difficultyEasy": "Mudah",
  "difficultyNormal": "Normal",
  "difficultyHard": "Sulit",
  "languagesButton": "Bahasa",
  "rendererButton": "Renderer: ",
  "rendererNaive": "Naive",
  "rendererBatched": "Batched",
  "doneButton": "Selesai",
  "preAlphaText": "Selamat datang di Cosmic Reach! \n Permainan ini masih dalam tahap pengembangan awal, masih kekurangan fitur, belum sepenuhnya selesai, \n dan kemungkinan besar akan memiliki bug, glitch, crash, dan kerusakan dunia permainan.\n Segala hal dapat berubah sewaktu-waktu dan belum mencerminkan versi final permainan ini.\n Permainan ini tersedia untuk kamu mainkan agar kamu dapat memberikan umpan balik untuk membantu memandu pengembangan permainan ini di masa mendatang.\n Selamat mencoba... dan merusak permainan!",
  "okButton": "Ok",
  "Lighting": "Pencahayaan: ",
  "Respawn": "Muncul kembali",
  "YOU_ARE_DEAD": "KAMU TELAH MATI.",
  "Return_To_Game": "Kembali ke Permainan",
  "Return_To_Menu": "Kembali ke Menu",
  "Saving": "Menyimpan...",
  "Dynamic_Sky": "Langit Dinamis",
  "Space_Day": "Siang Antariksa",
  "Space_Sky": "Langit Antariksa",
  "Dark_Night": "Malam Gelap",
  "Earth_Day": "Siang Bumi",
  "Orange_Sky": "Langit Jingga",
  "Pitch_Dark": "Gelap Gulita",
  "Overcast": "Mendung",
  "Forward": "Maju",
  "Backward": "Mundur",
  "Left": "Kiri",
  "Right": "Kanan",
  "Jump": "Lompat",
  "Crouch": "Jongkok",
  "Sprint": "Lari",
  "Prone": "Tengkurap",
  "Inventory": "Persediaan",
  "Cycle_Item_Type": "Ganti Jenis Item",
  "Drop_Item": "Jatuhkan Barang",
  "Hide_UI": "Sembunyikan UI",
  "Screenshot": "Tangkapan Layar",
  "Debug_Info": "Informasi Debug",
  "Attack_Break": "Serang / Hancurkan",
  "Pick_Block": "Pilih Blok",
  "Use_Place": "Gunakan / Tempatkan",
  "Open_Chat": "Buka Obrolan",
  "No_Clip": "No-Clip",
  "Change_Perspective": "Ubah Perspektif",
  "Reload_Shaders": "Muat Ulang Shader",
  "Fullscreen": "Layar Penuh",
  "Create_New_World": "Buat Dunia Baru",
  "worldNameButton": "Nama Dunia: ",
  "defaultWorldName": "Dunia Baru",
  "worldSeedLabel": "Benih Dunia: <Acak>",
  "worldSeedLabel2": "Benih Dunia: ",
  "worldType": "Jenis Dunia: ",
  "Return_to_Main_Menu": "Kembali ke Menu Utama",
  "returnButton": "Kembali",
  "Open_Worlds_Directory": "Buka Direktori Dunia",
  "YT_Channel": "Tonton video devlog di youtube.com/@finalforeach",
  "Game_version_prealpha": "Cosmic Reach Versi Pra-alpha-",
  "Game_version_alpha": "Cosmic Reach Versi Alpha-",
  "Game_version_beta": "Cosmic Reach Versi Beta-",
  "Game_version_release": "Cosmic Reach Versi ",
  "MAC_warning": "PERINGATAN: Mac belum didukung saat ini. Permainan ini kemungkinan besar tidak akan berfungsi.",
  "Controller": "Pengontrol",
  "Controllers": "Beberapa pengontrol",
  "Controller_info": " terdeteksi!\nDukungan pengontrol saat ini belum lengkap,\ndan akan ditingkatkan pada masa mendatang.",
  "on_state": "Hidup",
  "off_state": "Mati",
  "World_name": "Dunia-",
  "Screenshot_info": "Tangkapan layar disimpan ke ",
  "Screenshot_error": "Terjadi kesalahan saat menyimpan tangkapan layar.",
  "Loading": "Memuat",
  "mouseLeftButton": "Tombol Kiri",
  "mouseMiddleButton": "Tombol Tengah",
  "mouseRightButton": "Tombol Kanan",
  "mouseBackButton": "Tombol Belakang",
  "mouseForwardButton": "Tombol Depan",
  "RuntimeException": "Tidak dapat memuat dunia: ",
  "creditsGameBy": "GAME BY:",
  "creditsMusic": "MUSIC:",
  "creditsAdditionalProgramming": "ADDITIONAL PROGRAMMING:",
  "creditsAdditionalModelling": "ADDITIONAL MODELLING:",
  "creditsAdditionalTexturing": "ADDITIONAL TEXTURING:",
  "creditsAdditionalMobs": "ADDITIONAL MOBS:",
  "creditsLocalization": "LOCALIZATION:",
  "multiplayerButton": "Bermain Bersama",
  "multiplayerAddressButton": "Alamat: ",
  "multiplayerJoinButton": "Bergabung",
  "multiplayerBadDisconnect": "Terputus! Alasan:",
  "textDisplayInput": "Ketik di sini...",
  "skinChangeLabel": "Ubah Skin",
  "skinFileDesc": "Berkas PNG dengan ukuran 128x64 piksel",
  "itemCatalogSearch": "Telusuri...",
  "boomboxOctave": "Oktaf",
  "boomboxPlaySound": "Mainkan",
  "worldSelectionSearch": "Telusuri Dunia...",
  "createWorldGamemode": "Mode Permainan:",
  "gamemode_survival": "Sintas",
  "gamemode_creative": "Kreatif",
  "zone_base:earth": "Bumi",
  "zone_base:flat": "Datar",
  "zone_base:moon": "Bulan",
  "zone_base:nostalgic_island": "Pulau-Pulau Nostalgia",
  "zone_base:void": "Dunia Hampa",
  "mobUnnamed": "Tanpa Nama",
  "zone_base:earth_legacy": "Bumi (Lawas)",
  "comingSoon": "Segera hadir...",
  "langSelectionSearch": "Telusuri Bahasa...",
  "worldDescriptionName": "Nama Dunia:",
  "worldDescriptionHeader": "Deskripsi",
  "worldDescriptionGamemode": "Mode Permainan: ",
  "worldDescriptionGenerator": "Jenis Dunia: ",
  "worldDescriptionDefaultText": "Masukkan Deskripsi Dunia...",
  "worldSelectPlayWorld": "Bermain",
  "worldSelectSaveChanges": "Simpan Perubahan",
  "loadingAssets": "Aset",
  "loadingWorld": "Dunia",
  "multiplayerServerName": "Nama Peladen: ",
  "multiplayerAddServer": "Tambah Peladen",
  "multiplayerNewServerDefaultName": "Peladen Baru",
  "multiplayerDeleteServer": "Hapus Peladen",
  "multiplayerDeleteConfirmPrompt": "Apakah kamu yakin ingin menghapus {0}?",
  "multiplayerEditServer": "Sunting Peladen",
  "genericSelectionSearch": "Telusuri..."
}