{
  "$schema": "https://raw.githubusercontent.com/FinalForEach/Cosmic-Reach-Localization/master/assets/base/lang/game.schema.json",
  "metadata": {
    "name": "Čeština",
    "fallbacks": [
      "sk_sk",
      "en_us"
    ]
  },
  "formatPercent": "# %",
  "startButton": "Hrát",
  "loadButton": "Otevřít ukládací adresář",
  "optionsButton": "Nastavení",
  "quitButton": "Ukončit",
  "vSyncButton": "Vertikální synchronizace: ",
  "creditsButton": "Zásluhy",
  "renderDistSlider": "Vzdálenost vykreslování: ",
  "invertedMouseButton": "Invertovat myš: ",
  "mouseSensitivitySlider": "Citlivost myši: ",
  "soundSlider": "Zvuk: ",
  "musicSlider": "Hudba: ",
  "musicFreqSlider": "Frekvence hudby v minutách: ",
  "fovSlider": "FOV: ",
  "maxFPS": "Limit FPS: ",
  "maxFPSUnlimited": "Limit FPS: Bez limitu",
  "debugCrashButton": "Debug: Crashnout hru",
  "keybindsButton": "Klávesové zkratky",
  "difficultyButton": "Obtížnost: ",
  "difficultyPeaceful": "mírumilovná",
  "difficultyEasy": "jednoduchá",
  "difficultyNormal": "normální",
  "difficultyHard": "těžká",
  "languagesButton": "Jazyk - Language",
  "rendererButton": "Renderování: ",
  "rendererNaive": "Základní",
  "rendererBatched": "Po částech",
  "doneButton": "Hotovo",
  "preAlphaText": "Vítejte ve hře Cosmic Reach! \n Hra je v ve velmi rané fázi vývoje, chybí jí mnohé funkce a není zdaleka kompletní. \n Hra nejspíše stále obsahuje bugy, glitche a crashe což může vést k poškození světa.\n Všechno se může změnit a nemusí odpovídat konečnému vzhledu hry.\n Je k dispozici pro Vás abyste mohli poskytnout zpětnou vazbu a pomoct řídit budoucnost této hry \n Šťastné testování... a rozbíjení hry!",
  "okButton": "Ok",
  "Lighting": "Osvětlení: ",
  "Respawn": "Respawnout",
  "YOU_ARE_DEAD": "JSTE MTRVÍ.",
  "Return_To_Game": "Zpět do hry",
  "Return_To_Menu": "Zpět do menu",
  "Saving": "Ukládám...",
  "Dynamic_Sky": "Dynamická obloha",
  "Space_Day": "Vesmírný den",
  "Dark_Night": "Temná noc",
  "Earth_Day": "Pozemský den",
  "Orange_Sky": "Oranžová obloha",
  "Pitch_Dark": "Úplná tma",
  "Overcast": "Zataženo",
  "Forward": "Dopředu",
  "Backward": "Dozadu",
  "Left": "Doleva",
  "Right": "Doprava",
  "Jump": "Skočit",
  "Crouch": "Přikrčit se",
  "Sprint": "Sprintovat",
  "Prone": "Lehnout si",
  "Inventory": "Inventář",
  "Cycle_Item_Type": "Cyklicky měnit typ předmětu",
  "Drop_Item": "Zahodit předmet",
  "Hide_UI": "Skrýt UI",
  "Screenshot": "Snímek obrazovky",
  "Debug_Info": "Debugovací informace",
  "Attack_Break": "Útok/ničení",
  "Pick_Block": "Vzít blok",
  "Use_Place": "Položit blok",
  "Open_Chat": "Otevřít chat",
  "No_Clip": "Spectator",
  "Change_Perspective": "Změnit perspektivu",
  "Reload_Shaders": "Znovu načíst shadery",
  "Fullscreen": "Na celou obrazovku",
  "Create_New_World": "Vytvořit nový svět",
  "worldNameButton": "Název světa: ",
  "defaultWorldName": "Nový Svět",
  "worldSeedLabel": "Seed světa: <náhodný>",
  "worldSeedLabel2": "Seed světa: ",
  "worldType": "Typ světa: ",
  "Return_to_Main_Menu": "Zpět do hlavního menu",
  "returnButton": "Zpět",
  "Open_Worlds_Directory": "Otevřít adresář světů",
  "YT_Channel": "Sleduj změny na youtube.com/@finalforeach",
  "Game_version_prealpha": "Cosmic Reach verze Pre-alpha-",
  "Game_version_alpha": "Cosmic Reach verze Alpha-",
  "Game_version_beta": "Cosmic Reach verze Beta-",
  "Game_version_release": "Cosmic Reach verze ",
  "MAC_warning": "UPOZORNĚNÍ: Mac není zatím podporován. Hra nejspíše nebude fungovat.",
  "Controller": "Ovladač detekován",
  "Controllers": "Ovladače detekovány",
  "Controller_info": "!\nPodpora ovladačů není ještě dokončená,\na bude vylepšena v budoucích updatech.",
  "on_state": "Zapnuto",
  "off_state": "Vypnuto",
  "World_name": "Svět-",
  "Screenshot_info": "Snímek obrazovky uložen do ",
  "Screenshot_error": "Nastala chyba při ukládáni snímku obrazovky.",
  "Loading": "Načítám",
  "mouseLeftButton": "Levé tlačítko",
  "mouseMiddleButton": "Střední tlačítko",
  "mouseRightButton": "Pravé tlačítko",
  "mouseBackButton": "Tlačítko dozadu",
  "mouseForwardButton": "Tlačítko dopředu",
  "RuntimeException": "Svět se nepovedlo načíst: ",
  "creditsGameBy": "AUTOR HRY:",
  "creditsMusic": "HUDBA:",
  "creditsAdditionalProgramming": "DALŠÍ PROGRAMOVÁNÍ:",
  "creditsAdditionalModelling": "DALŠÍ MODELOVÁNÍ:",
  "creditsAdditionalTexturing": "DALŠÍ GRAFIKA:",
  "creditsAdditionalMobs": "DALŠÍ MOBOVÉ:",
  "creditsLocalization": "LOKALIZACE:",
  "multiplayerButton": "Multiplayer",
  "multiplayerAddressButton": "Adresa serveru: ",
  "multiplayerJoinButton": "Připojit",
  "multiplayerBadDisconnect": "Byli jste odpojeni. Důvod:",
  "textDisplayInput": "Pište zde...",
  "skinChangeLabel": "Změnit skin",
  "skinFileDesc": "Soubor typu PNG se 128x64 pixely",
  "itemCatalogSearch": "Hledat...",
  "boomboxOctave": "Oktáva",
  "boomboxPlaySound": "Přehrát",
  "worldSelectionSearch": "Vyhledat Světy...",
  "createWorldGamemode": "Herní režim:",
  "gamemode_survival": "Přežití",
  "gamemode_creative": "Tvoření",
  "zone_base:earth": "Země",
  "zone_base:flat": "Placka",
  "zone_base:moon": "Měsíc",
  "zone_base:nostalgic_island": "Nostalgické Ostrovy",
  "zone_base:void": "Prázdný Svět",
  "mobUnnamed": "Nepojmenovaný",
  "zone_base:earth_legacy": "Země (Stará)"
}
