{
  "$schema": "https://raw.githubusercontent.com/FinalForEach/Cosmic-Reach-Localization/master/assets/base/lang/game.schema.json",
  "metadata":
  {
    "name": "Magyar"
  },
  "formatPercent": "#%",
  "startButton": "Indítás",
  "loadButton": "Mentési mappa megnyitása",
  "optionsButton": "Beállítások",
  "quitButton": "Kilépés",
  "vSyncButton": "Vsync: ",
  "creditsButton": "Stáblista",
  "renderDistSlider": "Renderelési távolság: ",
  "invertedMouseButton": "Fordított egér: ",
  "mouseSensitivitySlider": "Egér érzékenység: ",
  "soundSlider": "Hang: ",
  "musicSlider": "Zene: ",
  "musicFreqSlider": "Zene frekvencia percekben: ",
  "fovSlider": "FOV: ",
  "maxFPS": "Max FPS: ",
  "maxFPSUnlimited": "Max FPS: Korlátlan",
  "debugCrashButton": "Hibakeresés: Játék összeomlasztása",
  "keybindsButton": "Irányítás",
  "difficultyButton": "Nehézség: ",
  "difficultyPeaceful": "Békés",
  "difficultyEasy": "Könnyű",
  "difficultyNormal": "Normál",
  "difficultyHard": "Nehéz",
  "languagesButton": "Nyelv",
  "rendererButton": "Renderelő: ",
  "rendererNaive": "Naiv",
  "rendererBatched": "Kötegelt",
  "doneButton": "Kész",
  "preAlphaText": "Üdvözöllek a Cosmic Reach-ben! \n A játék nagyon korai fejlesztési szakaszban van, hiányoznak funkciók, messze nincs kész \n és valószínűleg lesznek hibák, zavarok, összeomlások és világ korruptálódások.\n Minden változás alatt áll és nem képviseli a végső játékot.\n Elérhető, hogy játszhass vele, és visszajelzést adhass a játék jövőjének segítéséhez \n Jó szórakozást a teszteléshez... és játék-törést!",
  "okButton": "Oké",
  "Lighting": "Világítás: ",
  "Respawn": "Újraéledés",
  "YOU_ARE_DEAD": "MEGHALTÁL.",
  "Return_To_Game": "Vissza a játékba",
  "Return_To_Menu": "Vissza a menübe",
  "Saving": "Mentés...",
  "Dynamic_Sky": "Dinamikus ég",
  "Space_Day": "Űr nap",
  "Dark_Night": "Sötét éjszaka",
  "Earth_Day": "Föld nap",
  "Orange_Sky": "Narancssárga ég",
  "Pitch_Dark": "Koromsötét",
  "Overcast": "Felhős",
  "Forward": "Előre",
  "Backward": "Hátra",
  "Left": "Balra",
  "Right": "Jobbra",
  "Jump": "Ugrás",
  "Crouch": "Guggolás",
  "Sprint": "Sprintelés",
  "Prone": "Fekvés",
  "Inventory": "Eszköztár",
  "Cycle_Item_Type": "Tárgy típus váltás",
  "Drop_Item": "Tárgy elhajítása",
  "Hide_UI": "UI elrejtése",
  "Screenshot": "Képernyőkép",
  "Debug_Info": "Hibakeresési infó",
  "Attack_Break": "Támadás / Törés",
  "Pick_Block": "Blokk felszedése",
  "Use_Place": "Használ / Elhelyez",
  "Open_Chat": "Chat megnyitása",
  "No_Clip": "No-Clip",
  "Change_Perspective": "Perspektívaváltás",
  "Reload_Shaders": "Shaderek újratöltése",
  "Fullscreen": "Teljes képernyő",
  "Create_New_World": "Új világ létrehozása",
  "worldNameButton": "Világ neve: ",
  "defaultWorldName": "Új világ",
  "worldSeedLabel": "Világ mag: <Véletlenszerű>",
  "worldSeedLabel2": "Világ mag: ",
  "worldType": "Világ típusa: ",
  "Return_to_Main_Menu": "Vissza a főmenübe",
  "returnButton": "Vissza",
  "Open_Worlds_Directory": "Világok mappa megnyitása",
  "YT_Channel": "Nézd meg a fejlesztői naplókat a youtube.com/@finalforeach oldalon",
  "Game_version_prealpha": "Cosmic Reach Verzió Pre-alpha-",
  "Game_version_alpha": "Cosmic Reach Verzió Alpha-",
  "Game_version_beta": "Cosmic Reach Verzió Beta-",
  "Game_version_release": "Cosmic Reach Verzió ",
  "MAC_warning": "FIGYELEM: A Mac jelenleg nem támogatott. Valószínű, hogy a játék nem fog működni.",
  "Controller": "Kontroller",
  "Controllers": "Kontrollerek",
  "Controller_info": " érzékelve!\nA kontroller támogatás jelenleg hiányos\nés a későbbi frissítésekben javításra kerül.",
  "on_state": "Be",
  "off_state": "Ki",
  "World_name": "Világ-",
  "Screenshot_info": "Képernyőkép mentve ide: ",
  "Screenshot_error": "Hiba képernyőkép mentésekor.",
  "Loading": "Betöltés",
  "mouseLeftButton" : "Bal gomb",
  "mouseMiddleButton" : "Középső gomb",
  "mouseRightButton" : "Jobb gomb",
  "mouseBackButton" : "Vissza gomb",
  "mouseForwardButton" : "Előre gomb",
  "RuntimeException": "Nem sikerült betölteni a világot: ",
  "creditsGameBy": "JÁTÉK TŐLE:",
  "creditsMusic": "ZENE:",
  "creditsAdditionalProgramming": "TOVÁBBI PROGRAMOZÁS:",
  "creditsAdditionalModelling": "TOVÁBBI MODELLEZÉS:",
  "creditsAdditionalTexturing": "TOVÁBBI TEXTÚRÁLÁS:",
  "creditsAdditionalMobs": "TOVÁBBI MOBOK:",
  "creditsLocalization": "LOKALIZÁCIÓ:",
  "multiplayerButton": "Többjátékos mód",
  "multiplayerAddressButton": "Cím: ",
  "multiplayerJoinButton": "Csatlakozás",
  "multiplayerBadDisconnect": "Lecsatlakozva! Indok:",
  "textDisplayInput": "Írj ide...",
  "skinChangeLabel": "Válts kínézetet",
  "skinFileDesc": "PNG fájl 128x64 pixellel",
  "itemCatalogSearch": "Keresés...",
  "boomboxOctave": "Oktáv",
  "boomboxPlaySound": "Lejátszás",
  "worldSelectionSearch": "Világok keresése...",
  "createWorldGamemode": "Játékmód:",
  "gamemode_survival": "Túlélő",
  "gamemode_creative": "Kreatív",
  "zone_base:earth": "Föld",
  "zone_base:flat": "Lapos",
  "zone_base:moon": "Hold",
  "zone_base:nostalgic_island": "Nosztalgikus szigetek",
  "zone_base:void": "Üres világ",
  "mobUnnamed": "Névtelen",
  "zone_base:earth_legacy": "Föld (Régi)",
  "comingSoon": "Hamarosan...",
  "langSelectionSearch": "Nyelvek keresése...",
  "worldDescriptionName": "Világ neve:",
  "worldDescriptionHeader": "Leírás",
  "worldDescriptionGamemode": "Játékmód: ",
  "worldDescriptionGenerator": "Világ típusa: ",
  "worldDescriptionDefaultText": "Világ leírás megadása...",
  "worldSelectPlayWorld": "Játék",
  "worldSelectSaveChanges": "Változtatások mentése"
}
