{
  "$schema": "https://raw.githubusercontent.com/FinalForEach/Cosmic-Reach-Localization/master/assets/base/lang/game.schema.json",
  "metadata":
  {
    "name": "Filipino (Filipinas)",
    "fallbacks": ["tl_ph", "en_ph"]
  },
  "formatPercent": "#%",
  "startButton": "Magsimula",
  "loadButton": "Buksan ang Polder ng Save",
  "optionsButton": "Mga Opsyon",
  "quitButton": "Umalis",
  "vSyncButton": "Vsync: ",
  "creditsButton": "Mga Kredits",
  "renderDistSlider": "Layo ng Pagrerender: ",
  "invertedMouseButton": "Baliktarin ang Mouse: ",
  "mouseSensitivitySlider": "Paging sensitibo ng Mouse: ",
  "soundSlider": "Tinig: ",
  "musicSlider": "Musika: ",
  "fovSlider": "FOV: ",
  "maxFPS": "Max FPS: ",
  "maxFPSUnlimited": "Max FPS: Walang Limitasyon",
  "debugCrashButton": "Pagdebug: I-crash ang Laro",
  "keybindsButton": "Ayos ng Pindutan",
  "difficultyButton": "Hirap: ",
  "difficultyPeaceful": "Mapayapa",
  "difficultyEasy": "Madali",
  "difficultyNormal": "Katamtaman",
  "difficultyHard": "Mahirap",
  "languagesButton": "Wika",
  "rendererButton": "Renderer: ",
  "rendererNaive": "Naive",
  "rendererBatched": "Batched",
  "doneButton": "Tapos",
  "preAlphaText": "Maligayang pagdating sa Cosmic Reach! \n Nasa maagang yugto pa ang laro, maraming kulang, malayo pang makumpleto, \n at maaaring magkaroon ng mga bugs, teknikal na isyu, o kaya ay pagkasira ng mundo.\n Lahat ay pwede pang magbago at hindi kumakatawan sa huling anyo ng laro.\n Makakalaro ka upang makapagbigay katugunan at magabayan ang landas ng laro. \n Maligayang pagsubok... at pagkasira ng laro!",
  "okButton": "Sige",
  "Lighting": "Pag-iilaw: ",
  "Respawn": "Mabuhay muli",
  "YOU_ARE_DEAD": "NAMATAY KA.",
  "Return_To_Game": "Bumalik sa Laro",
  "Return_To_Menu": "Bumalik sa Menu",
  "Saving": "Sinasave...",
  "Dynamic_Sky": "Pabago-bagong Langit",
  "Space_Day": "Makalawakan",
  "Dark_Night": "Madilim na Gabi",
  "Earth_Day": "Araw ng Daigdig",
  "Orange_Sky": "Kahel na Langit",
  "Pitch_Dark": "Napakadilim",
  "Overcast": "Makulimlim",
  "Forward": "Pasulong",
  "Backward": "Umatras",
  "Left": "Kumaliwa",
  "Right": "Kumanan",
  "Jump": "Pagtalon",
  "Crouch": "Pagtago",
  "Sprint": "Pagtakbo",
  "Prone": "Dumapa",
  "Inventory": "Imbentaryo",
  "Cycle_Item_Type": "Baguhin ang Uri ng Bagay",
  "Drop_Item": "Bitawan ang Bagay",
  "Hide_UI": "Taguin ang UI",
  "Screenshot": "Magscreenshot",
  "Debug_Info": "Impormasyong pangdebug",
  "Attack_Break": "Umatake / Sumira",
  "Pick_Block": "Piliin ang Bloke",
  "Use_Place": "Gumamit / Maglagay",
  "Open_Chat": "Buksan ang Chat",
  "No_Clip": "Walang Banggaan",
  "Reload_Shaders": "I-reload ang mga Shaders",
  "Fullscreen": "Magfullscreen",
  "Create_New_World": "Gumawa ng Bagong Mudo",
  "worldNameButton": "Pangalan ng mundo: ",
  "defaultWorldName": "Bagong Mundo",
  "worldSeedLabel": "Binhi ng mundo: <Sapalaran>",
  "worldSeedLabel2": "Binhi ng mundo: ",
  "worldType": "Uri ng Mundo: ",
  "Return_to_Main_Menu": "Bumalik sa Panimulang Menu",
  "returnButton": "Bumalik",
  "Open_Worlds_Directory": "Buksan ang Direktoryo ng mga Mundo",
  "YT_Channel": "Panoorin ang mga devlogs sa youtube.com/@finalforeach",
  "Game_version_prealpha": "Cosmic Reach Bersyong Pre-alpha-",
  "MAC_warning": "BABALA: Hindi pa suportado ang Mac sa ngayon. Malamang hindi gagana ang laro.",
  "Controller": "Controller",
  "Controllers": "Controllers",
  "Controller_info": " ay nakita!\nHindi pa kumpleto ang suporta para sa mga controllers,\nat ipagpapabuti pa ito sa susunod na mga pagbabago.",
  "on_state": "Nakabukas",
  "off_state": "Nakapatay",
  "World_name": "Mundo-",
  "Screenshot_info": "Inilagay ang screenshot sa ",
  "Screenshot_error": "Umerror sa paglagay ng screenshot",
  "Loading": "Nag-loload",
  "mouseLeftButton" : "Kaliwang Pindutan",
  "mouseMiddleButton" : "Gitnang Pindutan",
  "mouseRightButton" : "Kanang Pindutan",
  "mouseBackButton" : "Pambalikang Pindutan",
  "mouseForwardButton" : "Pasulong na Pindutan",
  "RuntimeException": "Hindi ma-load ang mundong: ",
  "creditsGameBy": "LARO NI:",
  "creditsMusic": "MUSIKA:",
  "creditsAdditionalProgramming": "KARAGDAGANG PAGPROGRAMA:",
  "creditsAdditionalModelling": "KARAGDAGANG PAGMODELO:",
  "creditsAdditionalTexturing": "KARAGDAGANG PAGTEKSTURA:",
  "creditsLocalization": "LOKALISASYON:",
  "multiplayerButton": "Pangmaramihang Laro",
  "multiplayerAddressButton": "Address: ",
  "multiplayerJoinButton": "Sumali",
  "multiplayerBadDisconnect": "Nadisconnect! Dahilan:",
  "textDisplayInput": "Dito magsulat..."
}
